{
  "schema_version": "1.0",
  "id": "ACC-001",
  "project_id": "PRJ-001",
  "owner_batch": "B06",
  "title": "Example acceptance",
  "status": "not_run",
  "revision": 1,
  "requirement_id": "REQ-001",
  "criterion_ids": [],
  "candidate_sha": "0000000000000000000000000000000000000000",
  "evidence_ids": [],
  "unresolved_defect_ids": []
}
